{
  "topic_id": "topic-2026-03-001",
  "platform": "xiaohongshu",
  "publish_time": "2026-03-09T20:00:00+08:00",
  "views": 18000,
  "likes": 620,
  "comments": 58,
  "saves_or_favorites": 214,
  "completion_or_watch_quality": "前3秒留存一般，中段观点揭示后互动明显上升",
  "operator_notes": "标题抓力不够，但故事细节和反认知段落评论反馈很好。",
  "suggested_next_adjustments": [
    "下一轮开场更早给反差点",
    "标题增加人物或事件的猎奇张力",
    "原力创业映射再提前半段出现"
  ]
}
